{
  "context": {
    "trigger_event_id": "1",
    "role": "Planner",
    "attempt": 1,
    "context_id": "planner-session"
  },
  "checkpoint_commit": "bbbbbbbbbbbbbbbbbbbbbbbbbbbbbbbbbbbbbbbb",
  "summary": "Continue the same Planner assignment at the accepted effort after approved requirements.",
  "output_kind": "incremental",
  "artifacts": {
    "requirements": {
      "ref": ".docs/specs/example/requirements.md",
      "version": 1
    },
    "design": {
      "ref": ".docs/specs/example/design.md",
      "version": 1
    },
    "tasks": null
  },
  "artifact_changes": [
    {
      "artifact": "design",
      "previous_version": null,
      "current_version": 1,
      "change_kind": "material",
      "summary": "Record the current approved behavior and its rationale.",
      "rationale": "Make this artifact actionable for its downstream consumer."
    }
  ],
  "decisions": [
    "Manual retry is adequate for the accepted deployment."
  ],
  "constraints": [
    "Preserve existing nonempty-input behavior."
  ]
}
